id,choice_1,choice_1_script,choice_2,choice_2_script,choice_3,choice_3_script,choice_4,choice_4_script,episode,illustration,end,script
1,1,아이의 몸을 흔든다.,2,차가운 물수건을 얼굴이나 목에 덮어준다.,3,아이를 일으켜 세운 후에 세수를 시킨다.,4,아이의 입에 음식물을 넣어준다.,1,https://lh3.google.com/u/0/d/1eLnVLenCgnkOj7lAuaAUGKvssnju_a3t=w3360-h1736-iv1,false,"아이가 잠에서 일어나지 않습니다. 당신은 현재 도와줄 사람이 없고, 아이들의 아침을 비롯해서 여러가지 준비할 것들이 많습니다. 아이를 일어나게 하기 위해서는 가장 적절한 방법은 무엇일까요?"
2,5,입을 벌리고 강제로 쑤셔 넣는다.,6,밥상을 치운다.,7,"신경쓰지 않고, 부모만 밥을 먹는다.",8,밥을 먹으면 간식을 주겠다고 하며 유도한다.,1,https://lh3.google.com/u/0/d/1bqWRumBLFaaUb1TdUY8qwGbO-3Q4nrxW=w2250-h1736-iv1,false,당신의 아이가 일어났습니다. 아이가 밥에 들어간 콩 때문에 밥을 먹지 않겠다고 떼를 씁니다. 어떻게 해결해야 할까요? 가장 적절한 방법을 고르세요.
3,9,친구와 함께 학교에 가게끔 한다.,10,"아이와 대화를 나눈 후에, 학교에 가지 않게 한다.",11,"핸드폰을 준 후에, 아이에게 전화하라고 한다. ",12,"부모와 다시 만날거라는 확신을 줄 수 있는 물건을 준 후, 하교할 때 데리러 간다.",1,https://lh3.google.com/u/0/d/1RJ9A83tK-l7NxSmzP10GfucmX-rU7sRU=w2250-h1736-iv1,false,아이가 학교에 가지 않겠다고 떼를 씁니다. 어떻게 하면 아이를 학교에 보낼 수 있을까요?
4,13,아이들 앞에서 혼낸다.,14,아이에게 말하고 싶은 것이 있다면 큰 소리로 지금 말하고 한다.,15,아이들이 노는 주제로 같이 논다.,16,"아이에게 수업이 끝난 후에, 말할 시간을 준다고 말한다. ",1,https://lh3.google.com/u/0/d/13qk85vIOj_Vdi3V0QBmKYsC51L4ZMOg5=w2250-h1736-iv1,false,"아이가 수업에 집중하지 못하고, 수업 중에 큰소리를 내고, 집중하지 못합니다. 해결 방법으로 가장 적절한 것을 고르세요"
5,17,"싸운 친구를 욕하며, 너는 잘못한게 없다고 말한다.",18,아이에게 잘못한 부분에 대해서 무조건 사과하라고 한다. ,19,"싸운 이유가 아닌 무엇으로 인해 싸우게 되었는지 물어보며, 다른 관점을 제공한다.",20,"싸운 친구의 입장을 대신 말해주며, 잘못한 부분에 대해서 말해준다.",1,https://lh3.google.com/u/0/d/1JOTUVDJBl911OeWQxtDnbuaxoUU7BAlu=w2250-h1736-iv1,false,아이가 쉬는 시간 친구와 싸웠습니다. 해결 방법으로 가장 적절한 것을 고르세요
6,21,"아이가 강제로 공부하도록, 훈육함",22,"아이가 하기 싫음을 인정하고, 하고싶은 범위까지만 하도록 함",23,"아이가 하기 싫음을 인정하지만, 끝까지 하게끔 함",24,아이에게 해야만 하는 이유를 설명해줌,1,https://lh3.google.com/u/0/d/1LkC7_JPrUDkwS2L_M1jBerLOzkdrwNXi=w2250-h1736-iv1,false,"아이가 집에 온 후에, 숙제를 하지 않고, 누워서 핸드폰만 합니다. 어떻게 하면 아이가 과제를 하도록 할 수 있을까요?"
7,25,"큰 딸과 동생이 각각 잘못한 부분을 들어본 후에, 잘못한 부분을 혼낸다.",26,"상황을 파악한 후에, 잘못한 아이를 혼낸다.",27,"아이를 방으로 데려간 후에, 상황을 물어보고, 거짓말을 하더라도 끝까지 들어준다.",28,"각자 잘못한 점을 말해준 후에, 사과하도록 시킨다. ",1,https://lh3.google.com/u/0/d/1jUHjLSMU_fKHy0ZfoJIisSQ156p2DlC2=w2250-h1736-iv1,false,큰 딸이 동생과 장난감을 공유하지 않겠다면 싸웁니다. 해결 방법으로 가장 적절한 것은 무엇일까요?
8,29,자기 전 따뜻한 우유를 먹인다.,30,자기 전에 뛰어놀며 에너지를 소모시킴,31,아이가 졸릴 때 자게 하기,32,"정해진 자는 시간 전에 양치를 하고, 잠옷을 갈아입히고, 눕게 하기",1,https://lh3.google.com/u/0/d/1QacQTkQSIJ3QfMAKbO2pvu2Z7C9qXYUj=w2250-h1736-iv1,true,아이가 잠을 자려고 하지 않아요. 해결 방법으로 가장 적절한 것은 무엇일까요?
